B1: 洪水风险图计算表
B2: 位 置 | C2: 桩 号 | D2: 正 常河水位 | E2: 5千年一遇洪水位 | F2: 100年一遇洪水位 | G2: 50年一遇洪水位 | H2: 20年一遇洪水位 | I2: 溃坝水位
C3: m | D3: m | E3: m | F3: m | G3: m | H3: m | I3: m
B4: 那板水电站尾水D1 | C4: 0 | D4: 175.5 | E4: 182.61 | F4: 180.12 | G4: 179.39 | H4: 178.29 | I4: 207.27462638368414
B5: 六并 D2 | C5: 638 | D5: 174.82 | E5: =ROUND($E$4+($E$22-$E$4)/($C$22-$C$4)*(C5-$C$4),2) -> 182.5 | F5: =ROUND($F$4+($F$22-$F$4)/($C$22-$C$4)*(C5-$C$4),2) -> 180 | G5: =ROUND($G$4+($G$22-$G$4)/($C$22-$C$4)*(C5-$C$4),2) -> 179.27 | H5: =ROUND($H$4+($H$22-$H$4)/($C$22-$C$4)*(C5-$C$4),2) -> 178.18 | I5: 205.65044341273023
B6: W赖 1-1 | C6: 1566 | D6: 174.82 | E6: =ROUND($E$4+($E$22-$E$4)/($C$22-$C$4)*(C6-$C$4),2) -> 182.34 | F6: =ROUND($F$4+($F$22-$F$4)/($C$22-$C$4)*(C6-$C$4),2) -> 179.82 | G6: =ROUND($G$4+($G$22-$G$4)/($C$22-$C$4)*(C6-$C$4),2) -> 179.09 | H6: =ROUND($H$4+($H$22-$H$4)/($C$22-$C$4)*(C6-$C$4),2) -> 178.01 | I6: 204.35554792443685
B7: 三华桥 2-2 | C7: 4800 | D7: 171 | E7: =ROUND($E$4+($E$22-$E$4)/($C$22-$C$4)*(C7-$C$4),2) -> 181.77 | F7: =ROUND($F$4+($F$22-$F$4)/($C$22-$C$4)*(C7-$C$4),2) -> 179.2 | G7: =ROUND($G$4+($G$22-$G$4)/($C$22-$C$4)*(C7-$C$4),2) -> 178.46 | H7: =ROUND($H$4+($H$22-$H$4)/($C$22-$C$4)*(C7-$C$4),2) -> 177.43 | I7: 196.22409362829256
B8: 百计 3-3 | C8: 7300 | D8: 170.82 | E8: =ROUND($E$4+($E$22-$E$4)/($C$22-$C$4)*(C8-$C$4),2) -> 181.33 | F8: =ROUND($F$4+($F$22-$F$4)/($C$22-$C$4)*(C8-$C$4),2) -> 178.72 | G8: =ROUND($G$4+($G$22-$G$4)/($C$22-$C$4)*(C8-$C$4),2) -> 177.97 | H8: =ROUND($H$4+($H$22-$H$4)/($C$22-$C$4)*(C8-$C$4),2) -> 176.99 | I8: 195.16541766786526
B9: 明哲 4-4 | C9: 10300 | D9: 170.45 | E9: =ROUND($E$4+($E$22-$E$4)/($C$22-$C$4)*(C9-$C$4),2) -> 180.81 | F9: =ROUND($F$4+($F$22-$F$4)/($C$22-$C$4)*(C9-$C$4),2) -> 178.14 | G9: =ROUND($G$4+($G$22-$G$4)/($C$22-$C$4)*(C9-$C$4),2) -> 177.39 | H9: =ROUND($H$4+($H$22-$H$4)/($C$22-$C$4)*(C9-$C$4),2) -> 176.45 | I9: 193.90145272348178
B10: 云关山 D3 | C10: 12975 | D10: 170 | E10: =ROUND($E$4+($E$22-$E$4)/($C$22-$C$4)*(C10-$C$4),2) -> 180.34 | F10: =ROUND($F$4+($F$22-$F$4)/($C$22-$C$4)*(C10-$C$4),2) -> 177.63 | G10: =ROUND($G$4+($G$22-$G$4)/($C$22-$C$4)*(C10-$C$4),2) -> 176.87 | H10: =ROUND($H$4+($H$22-$H$4)/($C$22-$C$4)*(C10-$C$4),2) -> 175.97 | I10: 192.7708640539596
B11: 过梁山 D4 | C11: 14540 | D11: 170 | E11: =ROUND($E$4+($E$22-$E$4)/($C$22-$C$4)*(C11-$C$4),2) -> 180.07 | F11: =ROUND($F$4+($F$22-$F$4)/($C$22-$C$4)*(C11-$C$4),2) -> 177.33 | G11: =ROUND($G$4+($G$22-$G$4)/($C$22-$C$4)*(C11-$C$4),2) -> 176.57 | H11: =ROUND($H$4+($H$22-$H$4)/($C$22-$C$4)*(C11-$C$4),2) -> 175.69 | I11: 192.41449261847612
B12: 王侯山 D5 | C12: 16645 | D12: 170 | E12: =ROUND($E$4+($E$22-$E$4)/($C$22-$C$4)*(C12-$C$4),2) -> 179.7 | F12: =ROUND($F$4+($F$22-$F$4)/($C$22-$C$4)*(C12-$C$4),2) -> 176.93 | G12: =ROUND($G$4+($G$22-$G$4)/($C$22-$C$4)*(C12-$C$4),2) -> 176.16 | H12: =ROUND($H$4+($H$22-$H$4)/($C$22-$C$4)*(C12-$C$4),2) -> 175.32 | I12: 191.97655823721141
B13: 念纳 D6 | C13: 18042 | D13: 170 | E13: =ROUND($E$4+($E$22-$E$4)/($C$22-$C$4)*(C13-$C$4),2) -> 179.46 | F13: =ROUND($F$4+($F$22-$F$4)/($C$22-$C$4)*(C13-$C$4),2) -> 176.66 | G13: =ROUND($G$4+($G$22-$G$4)/($C$22-$C$4)*(C13-$C$4),2) -> 175.89 | H13: =ROUND($H$4+($H$22-$H$4)/($C$22-$C$4)*(C13-$C$4),2) -> 175.07 | I13: 191.70911157449211
B14: 百弄 D7 | C14: 19447 | D14: 170 | E14: =ROUND($E$4+($E$22-$E$4)/($C$22-$C$4)*(C14-$C$4),2) -> 179.21 | F14: =ROUND($F$4+($F$22-$F$4)/($C$22-$C$4)*(C14-$C$4),2) -> 176.39 | G14: =ROUND($G$4+($G$22-$G$4)/($C$22-$C$4)*(C14-$C$4),2) -> 175.62 | H14: =ROUND($H$4+($H$22-$H$4)/($C$22-$C$4)*(C14-$C$4),2) -> 174.82 | I14: 191.45677391524913
B15: 熟康圩 D8 | C15: 19757 | D15: 170 | E15: =ROUND($E$4+($E$22-$E$4)/($C$22-$C$4)*(C15-$C$4),2) -> 179.16 | F15: =ROUND($F$4+($F$22-$F$4)/($C$22-$C$4)*(C15-$C$4),2) -> 176.33 | G15: =ROUND($G$4+($G$22-$G$4)/($C$22-$C$4)*(C15-$C$4),2) -> 175.56 | H15: =ROUND($H$4+($H$22-$H$4)/($C$22-$C$4)*(C15-$C$4),2) -> 174.76 | I15: 191.4031918697271
B16: 熟康渡口 D9 | C16: 20126 | D16: 170 | E16: =ROUND($E$4+($E$22-$E$4)/($C$22-$C$4)*(C16-$C$4),2) -> 179.09 | F16: =ROUND($F$4+($F$22-$F$4)/($C$22-$C$4)*(C16-$C$4),2) -> 176.26 | G16: =ROUND($G$4+($G$22-$G$4)/($C$22-$C$4)*(C16-$C$4),2) -> 175.49 | H16: =ROUND($H$4+($H$22-$H$4)/($C$22-$C$4)*(C16-$C$4),2) -> 174.7 | I16: 191.34035400051991
B17: 河徐 D10 | C17: 21001 | D17: 170 | E17: =ROUND($E$4+($E$22-$E$4)/($C$22-$C$4)*(C17-$C$4),2) -> 178.94 | F17: =ROUND($F$4+($F$22-$F$4)/($C$22-$C$4)*(C17-$C$4),2) -> 176.09 | G17: =ROUND($G$4+($G$22-$G$4)/($C$22-$C$4)*(C17-$C$4),2) -> 175.32 | H17: =ROUND($H$4+($H$22-$H$4)/($C$22-$C$4)*(C17-$C$4),2) -> 174.54 | I17: 191.19530511120229
B18: 昌墩圩 5-5 | C18: 22360 | D18: 170 | E18: =ROUND($E$4+($E$22-$E$4)/($C$22-$C$4)*(C18-$C$4),2) -> 178.7 | F18: =ROUND($F$4+($F$22-$F$4)/($C$22-$C$4)*(C18-$C$4),2) -> 175.83 | G18: =ROUND($G$4+($G$22-$G$4)/($C$22-$C$4)*(C18-$C$4),2) -> 175.05 | H18: =ROUND($H$4+($H$22-$H$4)/($C$22-$C$4)*(C18-$C$4),2) -> 174.3 | I18: 190.98046394917657
B19: 观音山 D11 | C19: 23294 | D19: 170 | E19: =ROUND($E$4+($E$22-$E$4)/($C$22-$C$4)*(C19-$C$4),2) -> 178.54 | F19: =ROUND($F$4+($F$22-$F$4)/($C$22-$C$4)*(C19-$C$4),2) -> 175.65 | G19: =ROUND($G$4+($G$22-$G$4)/($C$22-$C$4)*(C19-$C$4),2) -> 174.87 | H19: =ROUND($H$4+($H$22-$H$4)/($C$22-$C$4)*(C19-$C$4),2) -> 174.13 | I19: 190.83970016554031
B20: 孔W 6－6 | C20: 26312 | D20: 170 | E20: =ROUND($E$4+($E$22-$E$4)/($C$22-$C$4)*(C20-$C$4),2) -> 178.01 | F20: =ROUND($F$4+($F$22-$F$4)/($C$22-$C$4)*(C20-$C$4),2) -> 175.07 | G20: =ROUND($G$4+($G$22-$G$4)/($C$22-$C$4)*(C20-$C$4),2) -> 174.29 | H20: =ROUND($H$4+($H$22-$H$4)/($C$22-$C$4)*(C20-$C$4),2) -> 173.59 | I20: 190.79561722457964
B21: 岽利山 D12 | C21: 26750 | D21: 170 | E21: =ROUND($E$4+($E$22-$E$4)/($C$22-$C$4)*(C21-$C$4),2) -> 177.93 | F21: =ROUND($F$4+($F$22-$F$4)/($C$22-$C$4)*(C21-$C$4),2) -> 174.99 | G21: =ROUND($G$4+($G$22-$G$4)/($C$22-$C$4)*(C21-$C$4),2) -> 174.2 | H21: =ROUND($H$4+($H$22-$H$4)/($C$22-$C$4)*(C21-$C$4),2) -> 173.51 | I21: 190.68746440352416
B22: 百细电站坝上 | C22: 29800 | D22: 170 | E22: 177.4 | F22: 174.4 | G22: 173.61 | H22: 172.97 | I22: 189.98155361378247
B23: 百细电站坝下 7-7 | C23: 29800 | D23: 164.5 | E23: 177 | F23: 172.2 | G23: 171.5 | H23: 169.8 | I23: 184.48155361378247
B24: 板旧 D13 | C24: 33300 | D24: 164.5 | E24: =ROUND($E$23+($E$27-$E$23)/($C$27-$C$23)*(C24-$C$23),2) -> 176.29 | F24: =ROUND($F$23+($F$27-$F$23)/($C$27-$C$23)*(C24-$C$23),2) -> 171.71 | G24: =ROUND($G$23+($G$27-$G$23)/($C$27-$C$23)*(C24-$C$23),2) -> 171.02 | H24: =ROUND($H$23+($H$27-$H$23)/($C$27-$C$23)*(C24-$C$23),2) -> 169.49 | I24: 183.76120277308493
B25: 那民 D14 | C25: 36500 | D25: 164.5 | E25: =ROUND($E$23+($E$27-$E$23)/($C$27-$C$23)*(C25-$C$23),2) -> 175.64 | F25: =ROUND($F$23+($F$27-$F$23)/($C$27-$C$23)*(C25-$C$23),2) -> 171.26 | G25: =ROUND($G$23+($G$27-$G$23)/($C$27-$C$23)*(C25-$C$23),2) -> 170.58 | H25: =ROUND($H$23+($H$27-$H$23)/($C$27-$C$23)*(C25-$C$23),2) -> 169.21 | I25: 183.17337490797055
B26: 路怀 D15 | C26: 41300 | D26: 164.5 | E26: =ROUND($E$23+($E$27-$E$23)/($C$27-$C$23)*(C26-$C$23),2) -> 174.67 | F26: =ROUND($F$23+($F$27-$F$23)/($C$27-$C$23)*(C26-$C$23),2) -> 170.59 | G26: =ROUND($G$23+($G$27-$G$23)/($C$27-$C$23)*(C26-$C$23),2) -> 169.92 | H26: =ROUND($H$23+($H$27-$H$23)/($C$27-$C$23)*(C26-$C$23),2) -> 168.79 | I26: 182.39668900657716
B27: 百龙电站坝上 | C27: 46500 | D27: 164.5 | E27: 173.62 | F27: 169.86 | G27: 169.2 | H27: 168.33 | I27: 181.67158511636447
B28: 百龙电站坝下 8-8 | C28: 46500 | D28: 153 | E28: 163.19 | F28: 159.18 | G28: 158.55 | H28: 157.78 | I28: 170.17158511636447
B29: 赖恒 | C29: 55500 | D29: 143 | E29: =ROUND($E$28+($E$31-$E$28)/($C$31-$C$28)*(C29-$C$28),2) -> 157.29 | F29: =ROUND($F$28+($F$31-$F$28)/($C$31-$C$28)*(C29-$C$28),2) -> 152.92 | G29: =ROUND($G$28+($G$31-$G$28)/($C$31-$C$28)*(C29-$C$28),2) -> 152.25 | H29: =ROUND($H$28+($H$31-$H$28)/($C$31-$C$28)*(C29-$C$28),2) -> 151.39 | I29: 159.33432247825101
B30: 赖烹 D16 | C30: 57500 | D30: 143 | E30: =ROUND($E$28+($E$31-$E$28)/($C$31-$C$28)*(C30-$C$28),2) -> 155.98 | F30: =ROUND($F$28+($F$31-$F$28)/($C$31-$C$28)*(C30-$C$28),2) -> 151.53 | G30: =ROUND($G$28+($G$31-$G$28)/($C$31-$C$28)*(C30-$C$28),2) -> 150.85 | H30: =ROUND($H$28+($H$31-$H$28)/($C$31-$C$28)*(C30-$C$28),2) -> 149.97 | I30: 159.099551555045
B31: 平福电站坝上 | C31: 66600 | D31: 143 | E31: 150.01 | F31: 145.21 | G31: 144.48 | H31: 143.51 | I31: 158.15960562005
B32: 平福电站坝下 9-9 | C32: 66600 | D32: 126.5 | E32: 148.35 | F32: 142.84 | G32: 141.95 | H32: 140.44 | I32: 141.65960562005014
B33: 那风 D17 | C33: 71268 | D33: 126.5 | E33: =ROUND($E$32+($E$43-$E$32)/($C$43-$C$32)*(C33-$C$32),2) -> 147.08 | F33: =ROUND($F$32+($F$43-$F$32)/($C$43-$C$32)*(C33-$C$32),2) -> 142.16 | G33: =ROUND($G$32+($G$43-$G$32)/($C$43-$C$32)*(C33-$C$32),2) -> 141.29 | H33: =ROUND($H$32+($H$43-$H$32)/($C$43-$C$32)*(C33-$C$32),2) -> 139.85 | I33: 141.24580208001026
B34: 那并 D18 | C34: 72375 | D34: 126.5 | E34: =ROUND($E$32+($E$43-$E$32)/($C$43-$C$32)*(C34-$C$32),2) -> 146.78 | F34: =ROUND($F$32+($F$43-$F$32)/($C$43-$C$32)*(C34-$C$32),2) -> 142 | G34: =ROUND($G$32+($G$43-$G$32)/($C$43-$C$32)*(C34-$C$32),2) -> 141.14 | H34: =ROUND($H$32+($H$43-$H$32)/($C$43-$C$32)*(C34-$C$32),2) -> 139.71 | I34: 141.15343986126535
B35: W秀 D19 | C35: 72828 | D35: 126.5 | E35: =ROUND($E$32+($E$43-$E$32)/($C$43-$C$32)*(C35-$C$32),2) -> 146.66 | F35: =ROUND($F$32+($F$43-$F$32)/($C$43-$C$32)*(C35-$C$32),2) -> 141.94 | G35: =ROUND($G$32+($G$43-$G$32)/($C$43-$C$32)*(C35-$C$32),2) -> 141.07 | H35: =ROUND($H$32+($H$43-$H$32)/($C$43-$C$32)*(C35-$C$32),2) -> 139.65 | I35: 141.116241488105
B36: 驮崇 10-10 | C36: 73600 | D36: 126.5 | E36: =ROUND($E$32+($E$43-$E$32)/($C$43-$C$32)*(C36-$C$32),2) -> 146.45 | F36: =ROUND($F$32+($F$43-$F$32)/($C$43-$C$32)*(C36-$C$32),2) -> 141.83 | G36: =ROUND($G$32+($G$43-$G$32)/($C$43-$C$32)*(C36-$C$32),2) -> 140.96 | H36: =ROUND($H$32+($H$43-$H$32)/($C$43-$C$32)*(C36-$C$32),2) -> 139.56 | I36: 141.05362913870226
B37: 在妙圩 11-11 | C37: 75800 | D37: 126.5 | E37: =ROUND($E$32+($E$43-$E$32)/($C$43-$C$32)*(C37-$C$32),2) -> 145.85 | F37: =ROUND($F$32+($F$43-$F$32)/($C$43-$C$32)*(C37-$C$32),2) -> 141.51 | G37: =ROUND($G$32+($G$43-$G$32)/($C$43-$C$32)*(C37-$C$32),2) -> 140.65 | H37: =ROUND($H$32+($H$43-$H$32)/($C$43-$C$32)*(C37-$C$32),2) -> 139.28 | I37: 140.88041727314524
B38: 迁隆 12-12 | C38: 78000 | D38: 126.5 | E38: =ROUND($E$32+($E$43-$E$32)/($C$43-$C$32)*(C38-$C$32),2) -> 145.26 | F38: =ROUND($F$32+($F$43-$F$32)/($C$43-$C$32)*(C38-$C$32),2) -> 141.19 | G38: =ROUND($G$32+($G$43-$G$32)/($C$43-$C$32)*(C38-$C$32),2) -> 140.34 | H38: =ROUND($H$32+($H$43-$H$32)/($C$43-$C$32)*(C38-$C$32),2) -> 139 | I38: 140.71454456947853
B39: 那弄 D20 | C39: 82067 | D39: 126.5 | E39: =ROUND($E$32+($E$43-$E$32)/($C$43-$C$32)*(C39-$C$32),2) -> 144.15 | F39: =ROUND($F$32+($F$43-$F$32)/($C$43-$C$32)*(C39-$C$32),2) -> 140.6 | G39: =ROUND($G$32+($G$43-$G$32)/($C$43-$C$32)*(C39-$C$32),2) -> 139.77 | H39: =ROUND($H$32+($H$43-$H$32)/($C$43-$C$32)*(C39-$C$32),2) -> 138.49 | I39: 140.42571437658162
B40: 那楼 D21 | C40: 90210 | D40: 126.5 | E40: =ROUND($E$32+($E$43-$E$32)/($C$43-$C$32)*(C40-$C$32),2) -> 141.95 | F40: =ROUND($F$32+($F$43-$F$32)/($C$43-$C$32)*(C40-$C$32),2) -> 139.42 | G40: =ROUND($G$32+($G$43-$G$32)/($C$43-$C$32)*(C40-$C$32),2) -> 138.63 | H40: =ROUND($H$32+($H$43-$H$32)/($C$43-$C$32)*(C40-$C$32),2) -> 137.46 | I40: 139.90825721242587
B41: 那苏 D22 | C41: 93050 | D41: 126.5 | E41: =ROUND($E$32+($E$43-$E$32)/($C$43-$C$32)*(C41-$C$32),2) -> 141.18 | F41: =ROUND($F$32+($F$43-$F$32)/($C$43-$C$32)*(C41-$C$32),2) -> 139.01 | G41: =ROUND($G$32+($G$43-$G$32)/($C$43-$C$32)*(C41-$C$32),2) -> 138.23 | H41: =ROUND($H$32+($H$43-$H$32)/($C$43-$C$32)*(C41-$C$32),2) -> 137.1 | I41: 139.74445705874584
B42: 品好 D23 | C42: 98535 | D42: 126.5 | E42: =ROUND($E$32+($E$43-$E$32)/($C$43-$C$32)*(C42-$C$32),2) -> 139.69 | F42: =ROUND($F$32+($F$43-$F$32)/($C$43-$C$32)*(C42-$C$32),2) -> 138.22 | G42: =ROUND($G$32+($G$43-$G$32)/($C$43-$C$32)*(C42-$C$32),2) -> 137.45 | H42: =ROUND($H$32+($H$43-$H$32)/($C$43-$C$32)*(C42-$C$32),2) -> 136.41 | I42: 139.44927782853841
B43: 鸠鸪电站坝上 D24 | C43: 108000 | D43: 126.5 | E43: 137.12 | F43: 136.85 | G43: 136.12 | H43: 135.21 | I43: 138.99680651392629