B2: 主坝长度(m) | C2: 总库容(m3) | D2: 经验系数 | E2: 坝高(m) | F2: 溃坝前上游水深(m) | G2: 溃口宽度(m) | H2: 溃坝坝址最大流量(m3/s) | I2: 泄空总历时(S) | J2: 溃洪下游河道最大流速 (m/s)
B3: B | C3: W | D3: K | E3: H | F3: H0 | G3: b | H3: Qm | I3: T | J3: Vmax
B4: 313 | C4: 428000000 | D4: 00.65 | E4: 59 | F4: 47 | G4: =0.1*D4*C4^(1/4)*B4^(1/4)*E4^(1/2) -> 302.05525037030276 | H4: =8/27*9.8^(1/2)*(B4/G4)^(1/4)*G4*F4^(3/2) -> 91082.915535875567 | I4: =5*C4/H4 -> 23495.07574949224 | J4: 5
B8: 那板水库溃坝后明江下游河段洪水计算
B9: 地点 | C9: 桩号 (m) | D9: 溃洪最大流量 (m3/s) | E9: 溃坝后最大洪水位 (m) | F9: 洪水起涨时间 (s) | G9: 最大流量到达时间 (s) | H9: 恢复历时 (h) | I9: 溃洪断面 (m2) | J9: 溃坝前河道水位 (m) | K9: 溃坝后最大洪水断面水深 (m)
C10: L | D10: QLm | E10: Zm | F10: T1 | G10: T2 | H10: T3 | I10: AL | J10: Z0 | K10: hm
B11: 那板水电站尾水 D1 | C11: 0 | D11: =H4 -> 91082.915535875567 | E11: =J11+K11 -> 207.27462638368414 | F11: =(0.0007*$C11^1.75*(10-2)^1.3/$C$4^0.2/$F$4^0.35) -> 0 | G11: =(1*$C11^1.4/$C$4^0.2/$F$4^0.5/$K11^0.25) -> 0 | H11: =(2*$C$4/$D11+F11)/3600 -> 2.6105639721658043 | I11: =D11/$J$4 -> 18216.583107175113 | J11: 175.5 | K11: 31.774626383684144
B12: 六并 D2 | C12: 638 | D12: =$C$4/($C$4/D$11+C12/$J$4/1.1) -> 88888.609210092895 | E12: =J12+K12 -> 205.65044341273023 | F12: =(0.0007*$C12^1.75*(10-2)^1.3/$C$4^0.2/$F$4^0.35) -> 4.1307432968705404 | G12: =(1*$C12^1.4/$C$4^0.2/$F$4^0.5/$K12^0.25) -> 9.8212400170466108 | H12: =(2*$C$4/$D12+F12)/3600 -> 2.6761558453038239 | I12: =D12/$J$4 -> 17777.721842018578 | J12: 174.82 | K12: 30.830443412730219
B13: W赖 1-1 | C13: 1566 | D13: =$C$4/($C$4/D$11+C13/$J$4/1.1) -> 85879.237670253657 | E13: =J13+K13 -> 204.35554792443685 | F13: =(0.0007*$C13^1.75*(10-2)^1.3/$C$4^0.2/$F$4^0.35) -> 19.882802336982227 | G13: =(1*$C13^1.4/$C$4^0.2/$F$4^0.5/$K13^0.25) -> 34.896712865419325 | H13: =(2*$C$4/$D13+F13)/3600 -> 2.7742687909967843 | I13: =D13/$J$4 -> 17175.847534050732 | J13: 174.82 | K13: 29.535547924436848
B14: 三华桥 2-2 | C14: 4800 | D14: =$C$4/($C$4/D$11+C14/$J$4/1.1) -> 76816.185590701105 | E14: =J14+K14 -> 196.22507251231215 | F14: =(0.0007*$C14^1.75*(10-2)^1.3/$C$4^0.2/$F$4^0.35) -> 141.17707655330014 | G14: =(1*$C14^1.4/$C$4^0.2/$F$4^0.5/$K14^0.25) -> 174.15740450410524 | H14: =(2*$C$4/$D14+F14)/3600 -> 3.1346283116124289 | I14: =D14/$J$4 -> 15363.237118140221 | J14: 171 | K14: 25.225072512312163
B15: 百计 3-3 | C15: 7300 | D15: =$C$4/($C$4/D$11+C15/$J$4/1.1) -> 71022.163017029525 | E15: =J15+K15 -> 195.16255832648494 | F15: =(0.0007*$C15^1.75*(10-2)^1.3/$C$4^0.2/$F$4^0.35) -> 294.0404131083007 | G15: =(1*$C15^1.4/$C$4^0.2/$F$4^0.5/$K15^0.25) -> 316.02596531854033 | H15: =(2*$C$4/$D15+F15)/3600 -> 3.4296156020696253 | I15: =D15/$J$4 -> 14204.432603405905 | J15: 170.82 | K15: 24.342558326484944
B16: 明哲 4-4 | C16: 10300 | D16: =$C$4/($C$4/D$11+C16/$J$4/1.1) -> 65127.324303893489 | E16: =J16+K16 -> 193.89468837148243 | F16: =(0.0007*$C16^1.75*(10-2)^1.3/$C$4^0.2/$F$4^0.35) -> 537.10248566415783 | G16: =(1*$C16^1.4/$C$4^0.2/$F$4^0.5/$K16^0.25) -> 516.56302389077132 | H16: =(2*$C$4/$D16+F16)/3600 -> 3.8001631474765554 | I16: =D16/$J$4 -> 13025.464860778698 | J16: 170.45 | K16: 23.444688371482435
B17: 云关山 D3 | C17: 12975 | D17: =$C$4/($C$4/D$11+C17/$J$4/1.1) -> 60639.496831432552 | E17: =J17+K17 -> 192.76112675990208 | F17: =(0.0007*$C17^1.75*(10-2)^1.3/$C$4^0.2/$F$4^0.35) -> 804.50715411434987 | G17: =(1*$C17^1.4/$C$4^0.2/$F$4^0.5/$K17^0.25) -> 718.9756647190444 | H17: =(2*$C$4/$D17+F17)/3600 -> 4.1446442422480736 | I17: =D17/$J$4 -> 12127.89936628651 | J17: 170 | K17: 22.761126759902083
B18: 过梁山 D4 | C18: 14540 | D18: =$C$4/($C$4/D$11+C18/$J$4/1.1) -> 58289.57008392155 | E18: =J18+K18 -> 192.40319862552496 | F18: =(0.0007*$C18^1.75*(10-2)^1.3/$C$4^0.2/$F$4^0.35) -> 981.92819486115854 | G18: =(1*$C18^1.4/$C$4^0.2/$F$4^0.5/$K18^0.25) -> 846.59359613795289 | H18: =(2*$C$4/$D18+F18)/3600 -> 4.3520086727585499 | I18: =D18/$J$4 -> 11657.914016784311 | J18: 170 | K18: 22.403198625524951
B19: 王侯山 D5 | C19: 16645 | D19: =$C$4/($C$4/D$11+C19/$J$4/1.1) -> 55401.814181733782 | E19: =J19+K19 -> 191.96335126275017 | F19: =(0.0007*$C19^1.75*(10-2)^1.3/$C$4^0.2/$F$4^0.35) -> 1244.0523849129368 | G19: =(1*$C19^1.4/$C$4^0.2/$F$4^0.5/$K19^0.25) -> 1028.0991135232387 | H19: =(2*$C$4/$D19+F19)/3600 -> 4.6374472103991948 | I19: =D19/$J$4 -> 11080.362836346756 | J19: 170 | K19: 21.963351262750169
B20: 念纳 D6 | C20: 18042 | D20: =$C$4/($C$4/D$11+C20/$J$4/1.1) -> 53638.260754944728 | E20: =J20+K20 -> 191.69473634162824 | F20: =(0.0007*$C20^1.75*(10-2)^1.3/$C$4^0.2/$F$4^0.35) -> 1432.4854068319919 | G20: =(1*$C20^1.4/$C$4^0.2/$F$4^0.5/$K20^0.25) -> 1154.4424105768414 | H20: =(2*$C$4/$D20+F20)/3600 -> 4.8309008275989322 | I20: =D20/$J$4 -> 10727.652150988946 | J20: 170 | K20: 21.694736341628229
B21: 百弄 D7 | C21: 19447 | D21: =$C$4/($C$4/D$11+C21/$J$4/1.1) -> 51974.336669516946 | E21: =J21+K21 -> 191.4412964230124 | F21: =(0.0007*$C21^1.75*(10-2)^1.3/$C$4^0.2/$F$4^0.35) -> 1633.3681917468957 | G21: =(1*$C21^1.4/$C$4^0.2/$F$4^0.5/$K21^0.25) -> 1286.0066574830935 | H21: =(2*$C$4/$D21+F21)/3600 -> 5.0286207931055982 | I21: =D21/$J$4 -> 10394.867333903388 | J21: 170 | K21: 21.4412964230124
B22: 熟康圩 D8 | C22: 19757 | D22: =$C$4/($C$4/D$11+C22/$J$4/1.1) -> 51621.014631268452 | E22: =J22+K22 -> 191.38748032082174 | F22: =(0.0007*$C22^1.75*(10-2)^1.3/$C$4^0.2/$F$4^0.35) -> 1679.2051934331239 | G22: =(1*$C22^1.4/$C$4^0.2/$F$4^0.5/$K22^0.25) -> 1315.6240723144742 | H22: =(2*$C$4/$D22+F22)/3600 -> 5.0726664248871263 | I22: =D22/$J$4 -> 10324.202926253691 | J22: 170 | K22: 21.387480320821744
B23: 熟康渡口 D9 | C23: 20126 | D23: =$C$4/($C$4/D$11+C23/$J$4/1.1) -> 51206.659340962382 | E23: =J23+K23 -> 191.32436796372991 | F23: =(0.0007*$C23^1.75*(10-2)^1.3/$C$4^0.2/$F$4^0.35) -> 1734.4731794753586 | G23: =(1*$C23^1.4/$C$4^0.2/$F$4^0.5/$K23^0.25) -> 1351.1505145135081 | H23: =(2*$C$4/$D23+F23)/3600 -> 5.1252913705049181 | I23: =D23/$J$4 -> 10241.331868192476 | J23: 170 | K23: 21.324367963729916
B24: 河徐 D10 | C24: 21001 | D24: =$C$4/($C$4/D$11+C24/$J$4/1.1) -> 50250.201469298634 | E24: =J24+K24 -> 191.17868547299801 | F24: =(0.0007*$C24^1.75*(10-2)^1.3/$C$4^0.2/$F$4^0.35) -> 1868.5812004469235 | G24: =(1*$C24^1.4/$C$4^0.2/$F$4^0.5/$K24^0.25) -> 1436.5592138327665 | H24: =(2*$C$4/$D24+F24)/3600 -> 5.2509274369364141 | I24: =D24/$J$4 -> 10050.040293859727 | J24: 170 | K24: 21.178685472998009
B25: 昌墩圩 5-5 | C25: 22360 | D25: =$C$4/($C$4/D$11+C25/$J$4/1.1) -> 48833.530707160724 | E25: =J25+K25 -> 190.96290584350285 | F25: =(0.0007*$C25^1.75*(10-2)^1.3/$C$4^0.2/$F$4^0.35) -> 2085.2957958339184 | G25: =(1*$C25^1.4/$C$4^0.2/$F$4^0.5/$K25^0.25) -> 1572.3888850752876 | H25: =(2*$C$4/$D25+F25)/3600 -> 5.448398662927751 | I25: =D25/$J$4 -> 9766.7061414321452 | J25: 170 | K25: 20.962905843502863
B26: 观音山 D11 | C26: 23294 | D26: =$C$4/($C$4/D$11+C26/$J$4/1.1) -> 47905.328984710955 | E26: =J26+K26 -> 190.8215271766172 | F26: =(0.0007*$C26^1.75*(10-2)^1.3/$C$4^0.2/$F$4^0.35) -> 2240.1089618851056 | G26: =(1*$C26^1.4/$C$4^0.2/$F$4^0.5/$K26^0.25) -> 1667.9225173031043 | H26: =(2*$C$4/$D26+F26)/3600 -> 5.5857457545076272 | I26: =D26/$J$4 -> 9581.0657969421918 | J26: 170 | K26: 20.821527176617192
B27: 孔W 6－6 | C27: 26312 | D27: =$C$4/($C$4/D$11+C27/$J$4/1.1) -> 45133.324500128365 | E27: =J27+K27 -> 190.75245473067943 | F27: =(0.0007*$C27^1.75*(10-2)^1.3/$C$4^0.2/$F$4^0.35) -> 2772.4343743188392 | G27: =(1*$C27^1.4/$C$4^0.2/$F$4^0.5/$K27^0.25) -> 1979.7500066783132 | H27: =(2*$C$4/$D27+F27)/3600 -> 6.0384624094765931 | I27: =D27/$J$4 -> 9026.664900025673 | J27: 170 | K27: 20.752454730679435
B28: 岽利山 D12 | C28: 26750 | D28: =$C$4/($C$4/D$11+C28/$J$4/1.1) -> 44757.46077269638 | E28: =J28+K28 -> 190.64457455715507 | F28: =(0.0007*$C28^1.75*(10-2)^1.3/$C$4^0.2/$F$4^0.35) -> 2853.7021677794769 | G28: =(1*$C28^1.4/$C$4^0.2/$F$4^0.5/$K28^0.25) -> 2028.6827378409098 | H28: =(2*$C$4/$D28+F28)/3600 -> 6.1052792207914166 | I28: =D28/$J$4 -> 8951.4921545392754 | J28: 170 | K28: 20.644574557155078
B29: 百细电站坝上 | C29: 29800 | D29: =$C$4/($C$4/D$11+C29/$J$4/1.1) -> 42304.207514229398 | E29: =J29+K29 -> 189.94044333110986 | F29: =(0.0007*$C29^1.75*(10-2)^1.3/$C$4^0.2/$F$4^0.35) -> 3447.2317506410127 | G29: =(1*$C29^1.4/$C$4^0.2/$F$4^0.5/$K29^0.25) -> 2380.2982895151281 | H29: =(2*$C$4/$D29+F29)/3600 -> 6.5782293574448722 | I29: =D29/$J$4 -> 8460.8415028458803 | J29: 170 | K29: 19.940443331109854
B30: 百细电站坝下 7-7 | C30: 29800 | D30: =$C$4/($C$4/D$11+C30/$J$4/1.1) -> 42304.207514229398 | E30: =J30+K30 -> 184.44044333110986 | F30: =(0.0007*$C30^1.75*(10-2)^1.3/$C$4^0.2/$F$4^0.35) -> 3447.2317506410127 | G30: =(1*$C30^1.4/$C$4^0.2/$F$4^0.5/$K30^0.25) -> 2380.2982895151281 | H30: =(2*$C$4/$D30+F30)/3600 -> 6.5782293574448722 | I30: =D30/$J$4 -> 8460.8415028458803 | J30: 164.5 | K30: 19.940443331109854
B31: 板旧 D13 | C31: 33300 | D31: =$C$4/($C$4/D$11+C31/$J$4/1.1) -> 39800.770716178355 | E31: =J31+K31 -> 183.72190845671213 | F31: =(0.0007*$C31^1.75*(10-2)^1.3/$C$4^0.2/$F$4^0.35) -> 4186.676721151488 | G31: =(1*$C31^1.4/$C$4^0.2/$F$4^0.5/$K31^0.25) -> 2806.3066020983438 | H31: =(2*$C$4/$D31+F31)/3600 -> 7.1371660916775808 | I31: =D31/$J$4 -> 7960.1541432356707 | J31: 164.5 | K31: 19.221908456712114
B32: 那民 D14 | C32: 36500 | D32: =$C$4/($C$4/D$11+C32/$J$4/1.1) -> 37757.891295058856 | E32: =J32+K32 -> 183.13556247449816 | F32: =(0.0007*$C32^1.75*(10-2)^1.3/$C$4^0.2/$F$4^0.35) -> 4915.9168884359606 | G32: =(1*$C32^1.4/$C$4^0.2/$F$4^0.5/$K32^0.25) -> 3215.7827487700629 | H32: =(2*$C$4/$D32+F32)/3600 -> 7.6629651280444806 | I32: =D32/$J$4 -> 7551.5782590117715 | J32: 164.5 | K32: 18.635562474498148
B33: 路怀 D15 | C33: 41300 | D33: =$C$4/($C$4/D$11+C33/$J$4/1.1) -> 35058.67314159227 | E33: =J33+K33 -> 182.36083455710749 | F33: =(0.0007*$C33^1.75*(10-2)^1.3/$C$4^0.2/$F$4^0.35) -> 6102.4553350446922 | G33: =(1*$C33^1.4/$C$4^0.2/$F$4^0.5/$K33^0.25) -> 3863.8205913521183 | H33: =(2*$C$4/$D33+F33)/3600 -> 8.4774076258398345 | I33: =D33/$J$4 -> 7011.7346283184543 | J33: 164.5 | K33: 17.860834557107491
B34: 百龙电站坝上 | C34: 46500 | D34: =$C$4/($C$4/D$11+C34/$J$4/1.1) -> 32538.718060522802 | E34: =J34+K34 -> 181.63755861538056 | F34: =(0.0007*$C34^1.75*(10-2)^1.3/$C$4^0.2/$F$4^0.35) -> 7509.9092080586279 | G34: =(1*$C34^1.4/$C$4^0.2/$F$4^0.5/$K34^0.25) -> 4609.0265830620538 | H34: =(2*$C$4/$D34+F34)/3600 -> 9.3936195602628967 | I34: =D34/$J$4 -> 6507.7436121045603 | J34: 164.5 | K34: 17.13755861538057
B35: 百龙电站坝下 8-8 | C35: 46500 | D35: =$C$4/($C$4/D$11+C35/$J$4/1.1) -> 32538.718060522802 | E35: =J35+K35 -> 170.13755861538056 | F35: =(0.0007*$C35^1.75*(10-2)^1.3/$C$4^0.2/$F$4^0.35) -> 7509.9092080586279 | G35: =(1*$C35^1.4/$C$4^0.2/$F$4^0.5/$K35^0.25) -> 4609.0265830620538 | H35: =(2*$C$4/$D35+F35)/3600 -> 9.3936195602628967 | I35: =D35/$J$4 -> 6507.7436121045603 | J35: 153 | K35: 17.13755861538057
B36: 赖恒 | C36: 55500 | D36: =$C$4/($C$4/D$11+C36/$J$4/1.1) -> 28938.620173529096 | E36: =J36+K36 -> 159.29728102551834 | F36: =(0.0007*$C36^1.75*(10-2)^1.3/$C$4^0.2/$F$4^0.35) -> 10235.398112347537 | G36: =(1*$C36^1.4/$C$4^0.2/$F$4^0.5/$K36^0.25) -> 5979.2085976222643 | H36: =(2*$C$4/$D36+F36)/3600 -> 11.05979072054517 | I36: =D36/$J$4 -> 5787.7240347058196 | J36: 143 | K36: 16.297281025518345
B37: 赖烹 D16 | C37: 57500 | D37: =$C$4/($C$4/D$11+C37/$J$4/1.1) -> 28244.18703776363 | E37: =J37+K37 -> 159.06312567651761 | F37: =(0.0007*$C37^1.75*(10-2)^1.3/$C$4^0.2/$F$4^0.35) -> 10889.570407803998 | G37: =(1*$C37^1.4/$C$4^0.2/$F$4^0.5/$K37^0.25) -> 6305.7940948064888 | H37: =(2*$C$4/$D37+F37)/3600 -> 11.443525449081056 | I37: =D37/$J$4 -> 5648.8374075527263 | J37: 143 | K37: 16.063125676517618
B38: 平福电站坝上 | C38: 66600 | D38: =$C$4/($C$4/D$11+C38/$J$4/1.1) -> 25463.904053074195 | E38: =J38+K38 -> 158.12564429915921 | F38: =(0.0007*$C38^1.75*(10-2)^1.3/$C$4^0.2/$F$4^0.35) -> 14082.245786569845 | G38: =(1*$C38^1.4/$C$4^0.2/$F$4^0.5/$K38^0.25) -> 7863.1718497780594 | H38: =(2*$C$4/$D38+F38)/3600 -> 13.249571640152377 | I38: =D38/$J$4 -> 5092.7808106148386 | J38: 143 | K38: 15.125644299159198
B39: 平福电站坝下 9-9 | C39: 66600 | D39: =$C$4/($C$4/D$11+C39/$J$4/1.1) -> 25463.904053074195 | E39: =J39+K39 -> 141.62564429915921 | F39: =(0.0007*$C39^1.75*(10-2)^1.3/$C$4^0.2/$F$4^0.35) -> 14082.245786569845 | G39: =(1*$C39^1.4/$C$4^0.2/$F$4^0.5/$K39^0.25) -> 7863.1718497780594 | H39: =(2*$C$4/$D39+F39)/3600 -> 13.249571640152377 | I39: =D39/$J$4 -> 5092.7808106148386 | J39: 126.5 | K39: 15.125644299159198
B40: 那风 D17 | C40: 71268 | D40: =$C$4/($C$4/D$11+C40/$J$4/1.1) -> 24239.90712033238 | E40: =J40+K40 -> 141.21292576053986 | F40: =(0.0007*$C40^1.75*(10-2)^1.3/$C$4^0.2/$F$4^0.35) -> 15854.681383333051 | G40: =(1*$C40^1.4/$C$4^0.2/$F$4^0.5/$K40^0.25) -> 8705.4245570624207 | H40: =(2*$C$4/$D40+F40)/3600 -> 14.213430012990642 | I40: =D40/$J$4 -> 4847.9814240664764 | J40: 126.5 | K40: 14.712925760539848
B41: 那并 D18 | C41: 72375 | D41: =$C$4/($C$4/D$11+C41/$J$4/1.1) -> 23966.707252505912 | E41: =J41+K41 -> 141.12080571743829 | F41: =(0.0007*$C41^1.75*(10-2)^1.3/$C$4^0.2/$F$4^0.35) -> 16288.160057045017 | G41: =(1*$C41^1.4/$C$4^0.2/$F$4^0.5/$K41^0.25) -> 8909.2982576594368 | H41: =(2*$C$4/$D41+F41)/3600 -> 14.445658937506591 | I41: =D41/$J$4 -> 4793.3414505011824 | J41: 126.5 | K41: 14.620805717438298
B42: W秀 D19 | C42: 72828 | D42: =$C$4/($C$4/D$11+C42/$J$4/1.1) -> 23856.677515575979 | E42: =J42+K42 -> 141.08370487917992 | F42: =(0.0007*$C42^1.75*(10-2)^1.3/$C$4^0.2/$F$4^0.35) -> 16466.988803743538 | G42: =(1*$C42^1.4/$C$4^0.2/$F$4^0.5/$K42^0.25) -> 8993.1758875741343 | H42: =(2*$C$4/$D42+F42)/3600 -> 14.541091165124868 | I42: =D42/$J$4 -> 4771.3355031151959 | J42: 126.5 | K42: 14.58370487917993
B43: 驮崇 10-10 | C43: 73600 | D43: =$C$4/($C$4/D$11+C43/$J$4/1.1) -> 23671.475321285143 | E43: =J43+K43 -> 141.0212567006493 | F43: =(0.0007*$C43^1.75*(10-2)^1.3/$C$4^0.2/$F$4^0.35) -> 16773.673843904413 | G43: =(1*$C43^1.4/$C$4^0.2/$F$4^0.5/$K43^0.25) -> 9136.7177004836558 | H43: =(2*$C$4/$D43+F43)/3600 -> 14.704261252038242 | I43: =D43/$J$4 -> 4734.2950642570286 | J43: 126.5 | K43: 14.521256700649294
B44: 在妙圩 11-11 | C44: 75800 | D44: =$C$4/($C$4/D$11+C44/$J$4/1.1) -> 23159.128829189238 | E44: =J44+K44 -> 140.84849900017787 | F44: =(0.0007*$C44^1.75*(10-2)^1.3/$C$4^0.2/$F$4^0.35) -> 17660.91209457146 | G44: =(1*$C44^1.4/$C$4^0.2/$F$4^0.5/$K44^0.25) -> 9549.8728032761646 | H44: =(2*$C$4/$D44+F44)/3600 -> 15.172938543890199 | I44: =D44/$J$4 -> 4631.8257658378479 | J44: 126.5 | K44: 14.348499000177853
B45: 迁隆 12-12 | C45: 78000 | D45: =$C$4/($C$4/D$11+C45/$J$4/1.1) -> 22668.490976032921 | E45: =J45+K45 -> 140.68306121816283 | F45: =(0.0007*$C45^1.75*(10-2)^1.3/$C$4^0.2/$F$4^0.35) -> 18567.677048218608 | G45: =(1*$C45^1.4/$C$4^0.2/$F$4^0.5/$K45^0.25) -> 9969.0153941543995 | H45: =(2*$C$4/$D45+F45)/3600 -> 15.647039919903294 | I45: =D45/$J$4 -> 4533.6981952065844 | J45: 126.5 | K45: 14.18306121816282
B46: 那弄 D20 | C46: 82067 | D46: =$C$4/($C$4/D$11+C46/$J$4/1.1) -> 21814.15495427014 | E46: =J46+K46 -> 140.39498834399151 | F46: =(0.0007*$C46^1.75*(10-2)^1.3/$C$4^0.2/$F$4^0.35) -> 20294.903717149235 | G46: =(1*$C46^1.4/$C$4^0.2/$F$4^0.5/$K46^0.25) -> 10759.293422067334 | H46: =(2*$C$4/$D46+F46)/3600 -> 16.537633186525444 | I46: =D46/$J$4 -> 4362.8309908540277 | J46: 126.5 | K46: 13.894988343991505
B47: 那楼 D21 | C47: 90210 | D47: =$C$4/($C$4/D$11+C47/$J$4/1.1) -> 20283.559102695432 | E47: =J47+K47 -> 139.87888796319749 | F47: =(0.0007*$C47^1.75*(10-2)^1.3/$C$4^0.2/$F$4^0.35) -> 23949.018195977449 | G47: =(1*$C47^1.4/$C$4^0.2/$F$4^0.5/$K47^0.25) -> 12399.776833122576 | H47: =(2*$C$4/$D47+F47)/3600 -> 18.3751902387252 | I47: =D47/$J$4 -> 4056.7118205390861 | J47: 126.5 | K47: 13.37888796319749
B48: 那苏 D22 | C48: 93050 | D48: =$C$4/($C$4/D$11+C48/$J$4/1.1) -> 19799.051682416572 | E48: =J48+K48 -> 139.71551729690032 | F48: =(0.0007*$C48^1.75*(10-2)^1.3/$C$4^0.2/$F$4^0.35) -> 25283.994057911517 | G48: =(1*$C48^1.4/$C$4^0.2/$F$4^0.5/$K48^0.25) -> 12989.552926680853 | H48: =(2*$C$4/$D48+F48)/3600 -> 19.032885553908901 | I48: =D48/$J$4 -> 3959.8103364833141 | J48: 126.5 | K48: 13.21551729690032
B49: 品好 D23 | C49: 98535 | D49: =$C$4/($C$4/D$11+C49/$J$4/1.1) -> 18925.93572901464 | E49: =J49+K49 -> 139.42111203272529 | F49: =(0.0007*$C49^1.75*(10-2)^1.3/$C$4^0.2/$F$4^0.35) -> 27949.589301878008 | G49: =(1*$C49^1.4/$C$4^0.2/$F$4^0.5/$K49^0.25) -> 14153.507308809692 | H49: =(2*$C$4/$D49+F49)/3600 -> 20.327369081273332 | I49: =D49/$J$4 -> 3785.1871458029282 | J49: 126.5 | K49: 12.921112032725285
B50: 鸠鸪电站坝上 D24 | C50: 108000 | D50: =$C$4/($C$4/D$11+C50/$J$4/1.1) -> 17587.56269048158 | E50: =J50+K50 -> 138.96982710723648 | F50: =(0.0007*$C50^1.75*(10-2)^1.3/$C$4^0.2/$F$4^0.35) -> 32815.844955567511 | G50: =(1*$C50^1.4/$C$4^0.2/$F$4^0.5/$K50^0.25) -> 16236.42709848445 | H50: =(2*$C$4/$D50+F50)/3600 -> 22.63516736891436 | I50: =D50/$J$4 -> 3517.5125380963159 | J50: 126.5 | K50: 12.469827107236487